URL,Nombre,Características,Descripción,Imagen,Precios
https://pc-builds.com/es/parts/cooler/PC272x/id-cooling-fx360-inf,ID-COOLING FX360 INF,"{'RPM máximas': '2,000', 'Ruido máximo': '27.2 dB', 'Altura': '60 mm', 'Refrigerado por agua': 'Sí', 'Longitud del radiador': '360 mm', 'Sin ventilador': 'No'}","The ID-COOLING FX360 INF cooler supports various sockets, including AM4, AM5, and multiple LGA variants, making it versatile for different builds. Standing at 60 mm in height, it caters to a range of cases while ensuring compatibility with standard motherboard configurations. The cooler operates within a minimum RPM of 300 and can ramp up to a maximum of 2,000 RPM, allowing for tailored cooling performance based on system demands.",https://m.media-amazon.com/images/I/41nF8kKQB3L._SL500_.jpg,"{'Nuevos': {'Cantidad': 1, 'Precio': '108.25 €.'}}"
https://pc-builds.com/es/parts/cooler/9Rhvmp/gigabyte-aorus-waterforce-x-ii-360-ice,Gigabyte AORUS WATERFORCE X II 360 ICE,"{'RPM máximas': '2,400', 'Ruido máximo': '37.5 dB', 'Altura': '78 mm', 'Refrigerado por agua': 'Sí', 'Longitud del radiador': '360 mm', 'Sin ventilador': 'No'}","The Gigabyte AORUS WATERFORCE X II 360 ICE is a liquid cooling solution designed to effectively manage CPU temperatures through a water-cooled system. It operates with a minimum fan RPM of 800 and can accelerate up to a maximum of 2,400 RPM, providing a range of cooling performance depending on system demands. Noise levels range from a quiet 12 dB at lower RPMs to a maximum of 37.5 dB, which is relatively moderate for high-performance cooling units.",https://m.media-amazon.com/images/I/31YRA39677L._SL500_.jpg,"{'Nuevos': {'Cantidad': 15, 'Precio': '240.00 €.'}, 'Utilizados': {'Cantidad': 2, 'Precio': '181.46 €.'}}"
https://pc-builds.com/es/parts/cooler/CrDA0g/corsair-h100i-v2,Corsair H100i v2,"{'RPM máximas': '2,435', 'Ruido máximo': '37.7 dB', 'Refrigerado por agua': 'Sí', 'Longitud del radiador': '240 mm', 'Sin ventilador': 'No'}","The Corsair H100i v2 operates at a consistent minimum and maximum RPM of 2,435, which ensures stable cooling performance under various loads. It generates a noise level of 37.7 dB, making it relatively quiet for a liquid cooler, although it is important for users to account for this noise in their builds, especially in quieter environments.",https://m.media-amazon.com/images/I/41Td5K1NeyL._SL500_.jpg,"{'Nuevos': {'Cantidad': 1, 'Precio': '16.39 €.'}}"
https://pc-builds.com/es/parts/cooler/ZLLdDY/in-win-sr36-pro,In Win SR36 PRO,"{'RPM máximas': '2,500', 'Ruido máximo': '23 dB', 'Altura': '100 mm', 'Refrigerado por agua': 'Sí', 'Longitud del radiador': '360 mm', 'Sin ventilador': 'No'}","The In Win SR36 PRO cooler features a notable minimum RPM of 500, allowing for efficient operation at lower speeds, while it can ramp up to a maximum of 2,500 RPM for enhanced cooling during intensive tasks. This variability in RPM supports a balance between performance and noise, with a consistent minimum and maximum noise level of 23 dB, indicating a relatively silent operation in both low and high-performance modes.",https://m.media-amazon.com/images/I/41wUs9lk0ZL._SL500_.jpg,"{'Nuevos': {'Cantidad': 2, 'Precio': '166.83 $.'}}"
https://pc-builds.com/es/parts/cooler/6rhKXF/cooler-master-wraith-ripper,Cooler Master Wraith Ripper,"{'Ruido máximo': '38 dB', 'Altura': '160 mm', 'Refrigerado por agua': 'No', 'Sin ventilador': 'No'}","The Cooler Master Wraith Ripper demonstrates a range of noteworthy specifications, particularly in its noise levels. It operates at a minimum noise level of 0 dB, making it completely silent during light tasks or minimal load conditions, while it can reach a maximum noise level of 38 dB under heavier loads, which is reasonable for an air cooler of its size and performance.",https://m.media-amazon.com/images/I/41TU5YjchHL._SL500_.jpg,"{'Nuevos': {'Cantidad': 1, 'Precio': '197.49 $.'}}"
https://pc-builds.com/es/parts/cooler/NqRhdT/enermax-liqmax-iii-argb,Enermax LIQMAX III ARGB,"{'RPM máximas': '1,600', 'Ruido máximo': '27 dB', 'Altura': '48 mm', 'Refrigerado por agua': 'Sí', 'Longitud del radiador': '120 mm', 'Sin ventilador': 'No'}","The Enermax LIQMAX III ARGB features a broad operational RPM range, with a minimum of 500 RPM and a maximum of 1,600 RPM, allowing it to adapt efficiently to different cooling demands. Noise levels are relatively low, ranging from 14 dB at minimum RPM to a maximum of 27 dB, making it suitable for quiet environments while still providing effective cooling performance. The cooler stands at a height of 48 mm, which should fit comfortably in most cases without obstructing other components.",https://m.media-amazon.com/images/I/41XIlvC4uJL._SL500_.jpg,"{'Nuevos': {'Cantidad': 2, 'Precio': '48.52 £.'}, 'Utilizados': {'Cantidad': 1, 'Precio': '38.93 £.'}}"
https://pc-builds.com/es/parts/cooler/wW8jkL/asus-rog-ryuo-240-rgb,Asus ROG RYUO 240 RGB,"{'RPM máximas': '2,500', 'Ruido máximo': '37 dB', 'Refrigerado por agua': 'Sí', 'Longitud del radiador': '240 mm', 'Sin ventilador': 'No'}","The Asus ROG RYUO 240 RGB cooler is designed to provide efficient cooling solutions with a double fan setup that operates between a minimum of 800 RPM to a maximum of 2,500 RPM. This dynamic RPM range allows for tailored cooling performance depending on the thermal demands of the system. The unit maintains a consistent noise level of 37 dB, which contributes to a quiet operating environment, though it does not feature a fanless mode.",https://m.media-amazon.com/images/I/31HMxW31vwL._SL500_.jpg,"{'Nuevos': {'Cantidad': 8, 'Precio': '158.15 €.'}}"
https://pc-builds.com/es/parts/cooler/Gc272x/silverstone-novapeak-240-argb,Silverstone NovaPeak 240 ARGB,"{'RPM máximas': '2,200', 'Ruido máximo': '33.1 dB', 'Altura': '63 mm', 'Refrigerado por agua': 'Sí', 'Longitud del radiador': '240 mm', 'Sin ventilador': 'No'}","The Silverstone NovaPeak 240 ARGB offers a range of features beneficial for cooling high-performance PC setups. Supporting a broad array of sockets including AM4, AM5, and various LGA options, it ensures compatibility with many popular processors. With a radiator length of 240 mm, it provides ample cooling surface area, which is crucial for maintaining optimal thermal performance in demanding computing tasks.",https://m.media-amazon.com/images/I/41QekCdxysL._SL500_.jpg,"{'Nuevos': {'Cantidad': 2, 'Precio': '63.99 $.'}}"
https://pc-builds.com/es/parts/cooler/wjmLHP/noctua-nh-u12s,Noctua NH-U12S,"{'RPM máximas': '1,500', 'Ruido máximo': '22.4 dB', 'Altura': '158 mm', 'Refrigerado por agua': 'No', 'Sin ventilador': 'No'}","The Noctua NH-U12S is a CPU cooler designed for effective heat dissipation, featuring a minimum RPM of 300 and a maximum RPM of 1,500. This range allows for adaptable performance, enabling the cooler to operate quietly at lower speeds while ramping up to provide more cooling capacity under higher loads. Noise levels are relatively low, with a minimum of 18.6 dB and a maximum of 22.4 dB, ensuring a quieter system environment, making it suitable for both casual and demanding setups.",https://m.media-amazon.com/images/I/41EtNCKEoDL._SL500_.jpg,"{'Nuevos': {'Cantidad': 4, 'Precio': '54.90 €.'}}"
https://pc-builds.com/es/parts/cooler/hPhvmp/thermaltake-th280-v2-argb-sync,Thermaltake TH280 V2 ARGB Sync,"{'RPM máximas': '1,800', 'Ruido máximo': '25.8 dB', 'Refrigerado por agua': 'Sí', 'Longitud del radiador': '280 mm', 'Sin ventilador': 'No'}","The Thermaltake TH280 V2 ARGB Sync cooler features a minimum RPM of 500 and a maximum of 1,800, offering a balance between performance and noise. The cooler operates at a consistent noise level of 25.8 dB, which indicates it maintains a relatively quiet operation during its function. This cooler is designed to support a wide variety of CPU sockets, covering both AMD and Intel platforms, including AM2 through AM5 for AMD and LGA1150 to LGA2066 for Intel.",https://m.media-amazon.com/images/I/41BbAUz2kOL._SL500_.jpg,"{'Nuevos': {'Cantidad': 1, 'Precio': '387.97 €.'}}"
https://pc-builds.com/es/parts/cooler/LyyHph/be-quiet-dark-rock-pro-5,be quiet! Dark Rock Pro 5,"{'RPM máximas': '2,000', 'Ruido máximo': '23.3 dB', 'Altura': '168 mm', 'Refrigerado por agua': 'No', 'Sin ventilador': 'No'}","The be quiet! Dark Rock Pro 5 is a tower cooler that features a minimum RPM of 1,300 and a maximum RPM of 2,000, allowing for efficient temperature management during various operating conditions. The cooler operates within a noise range from a minimum of 8.9 dB to a maximum of 23.3 dB, making it suitable for users seeking a balanced performance with low acoustic output.",https://m.media-amazon.com/images/I/415zjzHZxVL._SL500_.jpg,"{'Nuevos': {'Cantidad': 11, 'Precio': '119.90 $.'}, 'Utilizados': {'Cantidad': 1, 'Precio': '112.79 €.'}}"
https://pc-builds.com/es/parts/cooler/ssCFvf/msi-mag-coreliquid-r,MSI MAG CORELIQUID R,"{'RPM máximas': '2,000', 'Ruido máximo': '34.3 dB', 'Refrigerado por agua': 'Sí', 'Longitud del radiador': '240 mm', 'Sin ventilador': 'No'}","The MSI MAG CORELIQUID R features a range of specifications that make it a versatile choice for cooling performance. Its fan operates within a minimum of 500 RPM and can reach a maximum of 2,000 RPM, allowing for efficient thermal management according to load. The noise levels range from a quiet 14.3 dB at lower RPM up to 34.3 dB at maximum, providing a reasonable balance between cooling effectiveness and noise generation.",https://m.media-amazon.com/images/I/31GYAqq-IVL._SL500_.jpg,"{'Nuevos': {'Cantidad': 39, 'Precio': '89.90 €.'}, 'Utilizados': {'Cantidad': 51, 'Precio': '50.48 €.'}}"
https://pc-builds.com/es/parts/cooler/gs6BTb/thermalright-silver-arrow-ib-e,Thermalright SILVER ARROW IB-E,"{'RPM máximas': '1,300', 'Ruido máximo': '25 dB', 'Altura': '163 mm', 'Refrigerado por agua': 'No', 'Sin ventilador': 'No'}","The Thermalright SILVER ARROW IB-E cooler operates at a minimum RPM of 900 and can ramp up to a maximum of 1,300 RPM. This RPM range contributes to its noise levels, which vary from a quiet 21 dB at low speeds to a maximum of 25 dB under higher loads, allowing for relatively silent operation during casual use while still providing adequate cooling performance under stress.",https://m.media-amazon.com/images/I/51GWqFat6-L._SL500_.jpg,"{'Nuevos': {'Cantidad': 1, 'Precio': '79.99 €.'}}"
https://pc-builds.com/es/parts/cooler/s4Jn5e/silverstone-nt07-115x,Silverstone NT07-115X,"{'RPM máximas': '3,600', 'Ruido máximo': '34.7 dB', 'Altura': '23 mm', 'Refrigerado por agua': 'No', 'Sin ventilador': 'No'}","The Silverstone NT07-115X is a low-profile CPU cooler designed for compatibility primarily with Intel LGA1150 series sockets, including LGA1151, LGA1155, LGA1156, and LGA1200. Its height of 23 mm allows it to fit into compact builds or systems with limited space. The cooler utilizes a fan which operates at a minimum speed of 1,500 RPM and can reach a maximum RPM of 3,600, providing flexibility in performance and cooling efficiency.",https://m.media-amazon.com/images/I/410Ll0gk6VL._SL500_.jpg,"{'Nuevos': {'Cantidad': 6, 'Precio': '22.49 €.'}}"
https://pc-builds.com/es/parts/cooler/ZFgQPG/asus-rog-strix-lc-240,Asus ROG Strix LC 240,"{'RPM máximas': '2,500', 'Ruido máximo': '37.6 dB', 'Refrigerado por agua': 'Sí', 'Longitud del radiador': '240 mm', 'Sin ventilador': 'No'}","The Asus ROG Strix LC 240 is a water-cooled CPU cooler designed for efficient thermal management, capable of operating at a minimum RPM of 800 and reaching a maximum of 2,500 RPM. Its performance range allows for versatile cooling in different operating conditions, providing effective temperature regulation for high-performance processors. Despite its potential for high RPM, it maintains a consistent noise level at 37.6 dB, indicating a relatively quiet operation.",https://m.media-amazon.com/images/I/41VjVL3EdiL._SL500_.jpg,"{'Nuevos': {'Cantidad': 11, 'Precio': '153.60 €.'}}"
https://pc-builds.com/es/parts/cooler/FDdGjK/id-cooling-fx240,ID-COOLING FX240,"{'RPM máximas': '1,800', 'Ruido máximo': '35.2 dB', 'Refrigerado por agua': 'Sí', 'Longitud del radiador': '240 mm', 'Sin ventilador': 'No'}","The ID-COOLING FX240 cooler features a minimum RPM of 700 and a maximum of 1,800, allowing for dynamic adjustment according to cooling needs. It consistently operates at a noise level of 35.2 dB, which could be considered relatively quiet for a cooling solution in a PC setup. This combination of RPM and noise levels contributes to a balanced performance in cooling without excessive sound output.",https://m.media-amazon.com/images/I/314PSiRVDBL._SL500_.jpg,"{'Nuevos': {'Cantidad': 1, 'Precio': '66.62 €.'}}"
https://pc-builds.com/es/parts/cooler/qQQRJ6/thermaltake-contac-39,Thermaltake Contac 39,"{'RPM máximas': '2,000', 'Ruido máximo': '33.2 dB', 'Altura': '160 mm', 'Refrigerado por agua': 'No', 'Sin ventilador': 'No'}","The Thermaltake Contac 39 is a CPU cooler designed for compatibility with a wide range of socket types, including AMD's AM2 through FM2+ and Intel's LGA775 to LGA2066. This flexibility allows users to retrofit the cooler on various systems, ensuring versatile installation options for both enthusiasts and general users.",https://m.media-amazon.com/images/I/51b7ue+bw9L._SL500_.jpg,"{'Nuevos': {'Cantidad': 1, 'Precio': '28.23 €.'}}"
https://pc-builds.com/es/parts/cooler/rpTn5e/zalman-cnps10x-optima,Zalman CNPS10X OPTIMA,"{'RPM máximas': '1,700', 'Ruido máximo': '28 dB', 'Altura': '152 mm', 'Refrigerado por agua': 'No', 'Sin ventilador': 'No'}","The Zalman CNPS10X OPTIMA cooler operates within a minimum RPM of 1,000 and a maximum RPM of 1,700, providing a balanced performance for cooling needs. Noise levels range from a minimum of 17 dB to a maximum of 28 dB, which indicates a relatively quiet operation, suitable for users seeking low noise levels in their PC builds. With a height of 152 mm, it is designed to fit in most cases while ensuring efficient thermal management.",https://m.media-amazon.com/images/I/51XIUZARnfL._SL500_.jpg,"{'Nuevos': {'Cantidad': 2, 'Precio': '67.27 €.'}}"
https://pc-builds.com/es/parts/cooler/43grNz/asus-rog-ryujin-iii,Asus ROG Ryujin III,"{'RPM máximas': '2,200', 'Ruido máximo': '36.45 dB', 'Refrigerado por agua': 'Sí', 'Longitud del radiador': '240 mm', 'Sin ventilador': 'No'}","The Asus ROG Ryujin III is a liquid cooler designed for efficient thermal management in high-performance computing systems. It operates with a minimum RPM of 600 and can ramp up to a maximum of 2,200 RPM, allowing for dynamic adjustment based on cooling requirements. Both the minimum and maximum noise levels are specified at 36.45 dB, indicating consistent operational sound levels regardless of performance settings.",https://m.media-amazon.com/images/I/418r+WtSRIL._SL500_.jpg,"{'Nuevos': {'Cantidad': 1, 'Precio': '692.16 $.'}}"
https://pc-builds.com/es/parts/cooler/YJmn5e/ek-aio-elite-280-d-rgb,EK AIO Elite 280 D-RGB,"{'RPM máximas': '2,200', 'Ruido máximo': '36.4 dB', 'Refrigerado por agua': 'Sí', 'Longitud del radiador': '280 mm', 'Sin ventilador': 'No'}","The EK AIO Elite 280 D-RGB offers an effective cooling solution through its water cooling capability, designed to fit a wide range of sockets including AM4, AM5, and multiple LGA variants. This versatility makes it suitable for various CPUs, ensuring broad compatibility for users seeking enhanced cooling performance in their systems.",https://m.media-amazon.com/images/I/41emTBRtX-L._SL500_.jpg,"{'Nuevos': {'Cantidad': 1, 'Precio': '199.90 €.'}}"
https://pc-builds.com/es/parts/cooler/9gRFvf/cooler-master-masterliquid-lite-240,Cooler Master MasterLiquid Lite 240,"{'RPM máximas': '2,000', 'Ruido máximo': '30 dB', 'Refrigerado por agua': 'Sí', 'Longitud del radiador': '240 mm', 'Sin ventilador': 'No'}","The Cooler Master MasterLiquid Lite 240 features a dual 240 mm radiator designed for effective thermal management. It operates at a minimum speed of 650 RPM and can reach up to 2,000 RPM, allowing for a balance between noise output and cooling performance. The noise levels range from a quiet 6 dB at lower RPMs to a maximum of 30 dB, making it suitable for a variety of environments, including gaming and high-performance computing.",https://m.media-amazon.com/images/I/41NAfqSN2EL._SL500_.jpg,"{'Nuevos': {'Cantidad': 1, 'Precio': '133.99 $.'}}"
https://pc-builds.com/es/parts/cooler/6yMFvf/zalman-cnps5x-performa,Zalman CNPS5X Performa,"{'RPM máximas': '2,800', 'Ruido máximo': '32 dB', 'Altura': '134 mm', 'Refrigerado por agua': 'No', 'Sin ventilador': 'No'}","The Zalman CNPS5X Performa cooler operates within a minimum RPM of 1,400 and a maximum RPM of 2,800, providing a balanced performance for various cooling needs. Its noise levels range from a minimum of 20 dB to a maximum of 32 dB, making it a relatively quiet option suitable for most environments, although users should be aware of the upper limit which might become noticeable under load.",https://m.media-amazon.com/images/I/41LpkzditVL._SL500_.jpg,"{'Nuevos': {'Cantidad': 3, 'Precio': '19.35 €.'}}"
https://pc-builds.com/es/parts/cooler/RyPfHP/rosewill-rcx-z90-al,Rosewill RCX-Z90-AL,"{'RPM máximas': '3,000', 'Ruido máximo': '30 dB', 'Altura': '62 mm', 'Refrigerado por agua': 'No', 'Sin ventilador': 'No'}","The Rosewill RCX-Z90-AL cooler features a minimum RPM of 600 and a maximum RPM of 3,000, providing flexibility in cooling performance depending on the thermal requirements. This range allows it to operate efficiently under low-load conditions while ramping up to effectively dissipate heat during heavier usage.",https://m.media-amazon.com/images/I/417b0ZevKML._SL500_.jpg,"{'Nuevos': {'Cantidad': 1, 'Precio': '20.00 $.'}}"
https://pc-builds.com/es/parts/cooler/99XVjK/thermalright-frozen-prism,Thermalright Frozen Prism,"{'RPM máximas': '1,850', 'Ruido máximo': '27 dB', 'Refrigerado por agua': 'Sí', 'Longitud del radiador': '360 mm', 'Sin ventilador': 'No'}","The Thermalright Frozen Prism features a consistent operational performance, with a minimum and maximum RPM of 1,850, indicating a stable airflow rate that ensures optimal cooling under load. This uniform speed helps maintain temperature levels while minimizing fluctuations that could lead to overheating in high-performance scenarios. The noise output is also stable at 27 dB, suggesting that it operates quietly, making it suitable for environments where noise can be a concern.",https://m.media-amazon.com/images/I/31EaXT2Hm7L._SL500_.jpg,"{'Nuevos': {'Cantidad': 1, 'Precio': '57.90 €.'}}"
https://pc-builds.com/es/parts/cooler/wVwn5e/nzxt-kraken-elite-280,NZXT Kraken Elite 280,"{'RPM máximas': '1,500', 'Ruido máximo': '32.1 dB', 'Altura': '60 mm', 'Refrigerado por agua': 'Sí', 'Longitud del radiador': '280 mm', 'Sin ventilador': 'No'}","The NZXT Kraken Elite 280 is a capable cooler featuring a radiator size of 280 mm, which enhances its capacity for heat dissipation. It operates within a fan speed range of 500 to 1,500 RPM, allowing for customizable cooling solutions based on the needs of the system. This flexibility is critical for balancing performance and noise levels, making it suitable for both gamers and content creators.",https://m.media-amazon.com/images/I/311O3iCYCSL._SL500_.jpg,"{'Nuevos': {'Cantidad': 24, 'Precio': '179.63 €.'}, 'Utilizados': {'Cantidad': 8, 'Precio': '102.65 €.'}}"
https://pc-builds.com/es/parts/cooler/JfVGjK/nzxt-kraken-x63,NZXT Kraken X63,"{'RPM máximas': '2,000', 'Ruido máximo': '38 dB', 'Refrigerado por agua': 'Sí', 'Longitud del radiador': '280 mm', 'Sin ventilador': 'No'}","The NZXT Kraken X63 cooler features a wide operational RPM range, with a minimum of 500 RPM and a maximum of 2,000 RPM. This allows for adaptable cooling performance, balancing noise levels and thermal efficiency depending on the system's demands. Its noise levels range from a minimum of 21 dB to a maximum of 38 dB, indicating a relatively quiet operation during standard use, though it may become audible under heavy loads.",https://m.media-amazon.com/images/I/414DEMQQLcL._SL500_.jpg,"{'Nuevos': {'Cantidad': 1, 'Precio': '238.36 £.'}, 'Utilizados': {'Cantidad': 1, 'Precio': '181.66 $.'}}"
https://pc-builds.com/es/parts/cooler/sKjGjK/silenx-efz-92ha2,SilenX EFZ-92HA2,"{'RPM máximas': '2,400', 'Ruido máximo': '24 dB', 'Altura': '56 mm', 'Refrigerado por agua': 'No', 'Sin ventilador': 'No'}","The SilenX EFZ-92HA2 is designed with a fixed performance profile, operating at a consistent 2,400 RPM. This characteristic is beneficial for users who prefer a predictable cooling capability. It offers a noise range from a minimum of 8 dB, representing near-silent operation, to a maximum of 24 dB, which is relatively low compared to many other coolers, making it suitable for environments where noise is a consideration.",https://m.media-amazon.com/images/I/41v1kQ4Jv4L._SL500_.jpg,"{'Nuevos': {'Cantidad': 4, 'Precio': '52.36 $.'}}"
https://pc-builds.com/es/parts/cooler/gpjBTb/silverstone-hydrogon-d120-argb,Silverstone Hydrogon D120 ARGB,"{'Ruido máximo': '30.5 dB', 'Altura': '153 mm', 'Refrigerado por agua': 'No', 'Sin ventilador': 'No'}","The Silverstone Hydrogon D120 ARGB cooler offers a minimum noise level of 0 dB, making it ideal for users seeking a silent operation for their systems. However, it can reach a maximum noise output of 30.5 dB under load, which may be noticeable in quieter environments. The cooler stands at a height of 153 mm, fitting comfortably in a variety of cases while providing adequate airflow and cooling performance.",https://m.media-amazon.com/images/I/51ZonvMk65L._SL500_.jpg,"{'Nuevos': {'Cantidad': 6, 'Precio': '49.03 €.'}}"
https://pc-builds.com/es/parts/cooler/R2tKXF/thermaltake-th240-argb-sync,Thermaltake TH240 ARGB Sync,"{'RPM máximas': '1,500', 'Ruido máximo': '28.2 dB', 'Refrigerado por agua': 'Sí', 'Longitud del radiador': '240 mm', 'Sin ventilador': 'No'}","The Thermaltake TH240 ARGB Sync features a fixed rotation speed with a minimum and maximum RPM of 1,500, ensuring consistent airflow while maintaining a specific performance level across operations. The noise level is uniform, with both minimum and maximum ratings at 28.2 dB, indicating a relatively quiet operation suitable for environments where noise sensitivity is a concern.",https://m.media-amazon.com/images/I/41HBZZVpcfL._SL500_.jpg,"{'Nuevos': {'Cantidad': 3, 'Precio': '190.39 $.'}}"
https://pc-builds.com/es/parts/cooler/q7rRJ6/silverstone-hydrogon-d120-argb-v2,Silverstone Hydrogon D120 ARGB V2,"{'Ruido máximo': '30.5 dB', 'Altura': '153 mm', 'Refrigerado por agua': 'No', 'Sin ventilador': 'No'}","The Silverstone Hydrogon D120 ARGB V2 features a minimum noise level of 0 dB, allowing for silent operation during low workloads. Its maximum noise output reaches 30.5 dB under load, indicating it can offer a balance between performance and quietness, which is ideal for users who prefer a more subdued computing environment.",https://m.media-amazon.com/images/I/51ZonvMk65L._SL500_.jpg,"{'Nuevos': {'Cantidad': 6, 'Precio': '49.03 €.'}}"
https://pc-builds.com/es/parts/cooler/tttaa4/ek-aio-280-d-rgb,EK AIO 280 D-RGB,"{'RPM máximas': '2,000', 'Ruido máximo': '36.4 dB', 'Refrigerado por agua': 'Sí', 'Longitud del radiador': '280 mm', 'Sin ventilador': 'No'}","The EK AIO 280 D-RGB cooler features a minimum RPM of 500 and a maximum RPM of 2,000, allowing for effective cooling performance across a range of operational needs. It operates at a consistent noise level of 36.4 dB, which, while slightly elevated for an AIO cooler, provides a balance between performance and sound output expected from liquid cooling solutions.",https://m.media-amazon.com/images/I/31-BOL1yfZL._SL500_.jpg,N/A
https://pc-builds.com/es/parts/cooler/KtyVjK/be-quiet-shadow-rock-tf-2,be quiet! Shadow Rock TF 2,"{'RPM máximas': '1,400', 'Ruido máximo': '24.4 dB', 'Altura': '112 mm', 'Refrigerado por agua': 'No', 'Sin ventilador': 'No'}","The be quiet! Shadow Rock TF 2 operates at a fixed RPM of 1,400, ensuring consistent cooling performance. It maintains a minimum noise level of 11.9 dB, rising to a maximum of 24.4 dB under load, making it relatively quiet for a cooler of its type. With a height of 112 mm, it is compact enough to fit into various builds, ensuring compatibility without sacrificing cooling efficiency.",https://m.media-amazon.com/images/I/41Rc3j-NY3L._SL500_.jpg,"{'Nuevos': {'Cantidad': 29, 'Precio': '44.20 €.'}}"
https://pc-builds.com/es/parts/cooler/yjsoa4/fractal-design-celsius-s28-prisma-pwm-argb,Fractal Design Celsius+ S28 Prisma PWM ARGB,"{'RPM máximas': '1,700', 'Ruido máximo': '34.1 dB', 'Refrigerado por agua': 'Sí', 'Longitud del radiador': '280 mm', 'Sin ventilador': 'No'}","The Fractal Design Celsius+ S28 Prisma PWM ARGB cooler has a minimum RPM of 500 and can reach a maximum of 1,700 RPM, providing a wide range of cooling capabilities for various system demands. Its noise output remains stable at 34.1 dB, which indicates that the cooler is designed for a balance between performance and acoustic efficiency during operation. This is beneficial for users who prioritize a quieter computing experience while still needing adequate cooling.",https://m.media-amazon.com/images/I/41ZSNwPg-nL._SL500_.jpg,"{'Nuevos': {'Cantidad': 15, 'Precio': '142.45 €.'}}"
