URL,Nombre,Características,Descripción,Imagen,Precios
https://pc-builds.com/es/parts/cooler/QKchdT/msi-mag-coreliquid-m240,MSI MAG CORELIQUID M240,"{'RPM máximas': '2,000', 'Ruido máximo': '34.3 dB', 'Refrigerado por agua': 'Sí', 'Longitud del radiador': '240 mm', 'Sin ventilador': 'No'}","The MSI MAG CORELIQUID M240 is a water-cooled CPU cooler that features a radiator length of 240 mm, making it suitable for moderate to high-performance cooling solutions. It supports a wide range of sockets including AM4, AM5, various LGA sockets, which ensures compatibility with multiple CPU types, appealing to a diverse user base.",https://m.media-amazon.com/images/I/31eMk-m5oVL._SL500_.jpg,"{'Nuevos': {'Cantidad': 49, 'Precio': '80.30 €.'}, 'Utilizados': {'Cantidad': 1, 'Precio': '99.66 €.'}}"
https://pc-builds.com/es/parts/cooler/DPcGjK/phanteks-glacier-one-280mph,Phanteks Glacier One 280MPH,"{'RPM máximas': '2,200', 'Ruido máximo': '39.1 dB', 'Refrigerado por agua': 'Sí', 'Longitud del radiador': '280 mm', 'Sin ventilador': 'No'}","The Phanteks Glacier One 280MPH cooler is engineered for efficient thermal management, supporting a wide range of socket types including AM4, AM5, and various Intel LGA models, making it versatile for different builds. With a radiator length of 280mm, it is designed to maximize surface area for heat dissipation, enhancing the overall cooling performance.",https://m.media-amazon.com/images/I/31wYaJq7agL._SL500_.jpg,"{'Nuevos': {'Cantidad': 3, 'Precio': '159.90 €.'}}"
https://pc-builds.com/es/parts/cooler/pztCCO/silverstone-ar03,Silverstone AR03,"{'RPM máximas': '2,200', 'Ruido máximo': '33.5 dB', 'Altura': '159 mm', 'Refrigerado por agua': 'No', 'Sin ventilador': 'No'}","The Silverstone AR03 cooler features a minimum RPM of 1,000 and a maximum RPM of 2,200, providing a flexible range for different cooling needs. Noise levels vary accordingly, with minimum noise recorded at 16.39 dB and maximum noise at 33.5 dB, making it relatively quiet during operation while still capable of higher performance when required. With a height of 159 mm, it fits within most standard cases while maintaining efficient airflow.",https://m.media-amazon.com/images/I/516bkozbXvL._SL500_.jpg,"{'Nuevos': {'Cantidad': 2, 'Precio': '41.60 €.'}}"
https://pc-builds.com/es/parts/cooler/KL3NDY/thermalright-frozen-infinity-240-argb,Thermalright Frozen Infinity 240 ARGB,"{'RPM máximas': '2,000', 'Ruido máximo': '28.2 dB', 'Altura': '60 mm', 'Refrigerado por agua': 'Sí', 'Longitud del radiador': '240 mm', 'Sin ventilador': 'No'}","The Thermalright Frozen Infinity 240 ARGB cooler operates at a fixed RPM of 2,000, ensuring consistent performance while maintaining a minimum noise level of 28.2 dB. This noise level is relatively low, making it suitable for quiet builds, though it does not offer variable speed settings which could help minimize noise during less intensive tasks.",https://m.media-amazon.com/images/I/41ys+9ET1zL._SL500_.jpg,"{'Nuevos': {'Cantidad': 1, 'Precio': '79.51 $.'}}"
https://pc-builds.com/es/parts/cooler/xCL8eR/noctua-nh-d15s,Noctua NH-D15S,"{'RPM máximas': '1,500', 'Ruido máximo': '24.6 dB', 'Altura': '160 mm', 'Refrigerado por agua': 'No', 'Sin ventilador': 'No'}","The Noctua NH-D15S is a high-performance air cooler designed to provide efficient thermal management. With a minimum RPM of 300 and a maximum of 1,500, it allows for optimized cooling depending on the system's demand. The noise level ranges from a minimum of 19.2 dB, which is relatively quiet, to a maximum of 24.6 dB, making it suitable for users prioritizing a quieter environment.",https://m.media-amazon.com/images/I/51H3ITbJWQL._SL500_.jpg,"{'Nuevos': {'Cantidad': 5, 'Precio': '109.90 €.'}}"
https://pc-builds.com/es/parts/cooler/VF2ksn/corsair-h50,Corsair H50,"{'RPM máximas': '1,700', 'Ruido máximo': '30.32 dB', 'Refrigerado por agua': 'Sí', 'Longitud del radiador': '120 mm', 'Sin ventilador': 'No'}","The Corsair H50 cooler operates at a fixed RPM of 1,700, providing a consistent airflow and cooling performance. With a minimum and maximum noise level of 30.32 dB, it maintains a relatively quiet operation, suitable for various gaming and workstation setups.",https://m.media-amazon.com/images/I/41EyDjstL7L._SL500_.jpg,"{'Utilizados': {'Cantidad': 2, 'Precio': '67.00 $.'}}"
https://pc-builds.com/es/parts/cooler/kNK8eR/scythe-mugen-4,Scythe Mugen 4,"{'RPM máximas': '1,400', 'Ruido máximo': '28 dB', 'Altura': '156 mm', 'Refrigerado por agua': 'No', 'Sin ventilador': 'No'}","The Scythe Mugen 4 is designed with a wide operational RPM range, spanning from a minimum of 400 to a maximum of 1,400 RPM. This flexibility allows for adequate cooling performance across various system demands, while the noise output is relatively low, ranging from 5.3 dB at its lowest speed to 28 dB at maximum load, ensuring a quieter operation during regular use.",https://m.media-amazon.com/images/I/51iKzvZoQfL._SL500_.jpg,"{'Utilizados': {'Cantidad': 1, 'Precio': '39.99 €.'}, 'Nuevos': {'Cantidad': 2, 'Precio': '47.61 €.'}}"
https://pc-builds.com/es/parts/cooler/3TLdDY/xilence-a200,Xilence A200,"{'RPM máximas': '2,200', 'Ruido máximo': '32 dB', 'Altura': '69 mm', 'Refrigerado por agua': 'No', 'Sin ventilador': 'No'}","The Xilence A200 cooler features a fixed operational speed of 2,200 RPM, offering a consistent airflow and cooling performance. With both minimum and maximum RPM set at the same value, this model targets efficiency in thermal management for compatible systems. It is engineered to fit AM4 sockets, making it ideal for users employing AMD processors.",https://m.media-amazon.com/images/I/41LtYpp0+7L._SL500_.jpg,"{'Nuevos': {'Cantidad': 8, 'Precio': '5.90 €.'}}"
https://pc-builds.com/es/parts/cooler/79bRJ6/thermalright-peerless-assassin-120-se,Thermalright Peerless Assassin 120 SE,"{'RPM máximas': '1,550', 'Ruido máximo': '25.6 dB', 'Altura': '155 mm', 'Refrigerado por agua': 'No', 'Sin ventilador': 'No'}","The Thermalright Peerless Assassin 120 SE operates at a consistent minimum and maximum RPM of 1,550, providing stable airflow during operation. With a noise level rated at 25.6 dB, it strikes a balance between performance and acoustic outputs, ensuring a relatively quiet cooling solution under typical usage conditions. The cooler's height of 155 mm allows for compatibility in a variety of cases, provided that there is sufficient clearance.",https://m.media-amazon.com/images/I/41mGyDMBymL._SL500_.jpg,"{'Nuevos': {'Cantidad': 1, 'Precio': '44.90 €.'}}"
https://pc-builds.com/es/parts/cooler/NDtWX5/noctua-nh-u12s-tr4-sp3,Noctua NH-U12S TR4-SP3,"{'RPM máximas': '1,500', 'Ruido máximo': '22.4 dB', 'Altura': '158 mm', 'Refrigerado por agua': 'No', 'Sin ventilador': 'No'}","The Noctua NH-U12S TR4-SP3 cooler features a minimum RPM of 300 and a maximum RPM of 1,500, allowing for efficient cooling performance while potentially minimizing noise levels. It operates within a noise range of 18.6 dB at its lowest speed and up to 22.4 dB at full speed, making it relatively quiet compared to many other cooling solutions.",https://m.media-amazon.com/images/I/51BiunNGETL._SL500_.jpg,"{'Nuevos': {'Cantidad': 1, 'Precio': '89.90 €.'}}"
https://pc-builds.com/es/parts/cooler/Pp8bJe/msi-mpg-coreliquid-k240,MSI MPG CORELIQUID K240,"{'Ruido máximo': '39.9 dB', 'Refrigerado por agua': 'Sí', 'Longitud del radiador': '240 mm', 'Sin ventilador': 'No'}","The MSI MPG CORELIQUID K240 cooler features a minimum noise level of 0 dB, making it virtually silent at idle or low usage, while its maximum noise level reaches 39.9 dB under heavy load. This variance provides a balance for users seeking low noise in everyday use without sacrificing performance when required.",https://m.media-amazon.com/images/I/41SGIENYbtL._SL500_.jpg,"{'Nuevos': {'Cantidad': 6, 'Precio': '155.52 €.'}}"
https://pc-builds.com/es/parts/cooler/fhqbJe/noctua-nh-l9x65,Noctua NH-L9x65,"{'RPM máximas': '2,500', 'Ruido máximo': '23.6 dB', 'Altura': '65 mm', 'Refrigerado por agua': 'No', 'Sin ventilador': 'No'}","The Noctua NH-L9x65 cooler operates at a minimum speed of 600 RPM and can ramp up to a maximum of 2,500 RPM. Its noise levels range from 14.8 dB at the lower end to 23.6 dB at full speed, making it a relatively quiet option for users seeking an efficient cooling solution. With a height of 65 mm, it is suitable for compact builds while maintaining effective thermal management.",https://m.media-amazon.com/images/I/41QBvgoMVoL._SL500_.jpg,"{'Nuevos': {'Cantidad': 4, 'Precio': '59.90 €.'}}"
https://pc-builds.com/es/parts/cooler/hbnGjK/noctua-nh-l12s,Noctua NH-L12S,"{'RPM máximas': '1,850', 'Ruido máximo': '23.9 dB', 'Altura': '70 mm', 'Refrigerado por agua': 'No', 'Sin ventilador': 'No'}","The Noctua NH-L12S cooler operates within a minimum RPM of 450 and a maximum of 1,850, allowing for flexible cooling performance based on system demands. It achieves a minimum noise level of 16.8 dB, making it suitable for quiet builds, while the maximum noise level reaches 23.9 dB under load, which is still relatively low compared to other cooling solutions.",https://m.media-amazon.com/images/I/415gVisKEHL._SL500_.jpg,"{'Nuevos': {'Cantidad': 6, 'Precio': '69.90 €.'}, 'Utilizados': {'Cantidad': 2, 'Precio': '63.31 €.'}}"
https://pc-builds.com/es/parts/cooler/Tk9oa4/id-cooling-fx360-inf,ID-COOLING FX360 INF,"{'RPM máximas': '2,900', 'Ruido máximo': '25 dB', 'Refrigerado por agua': 'Sí', 'Longitud del radiador': '360 mm', 'Sin ventilador': 'No'}","The ID-COOLING FX360 INF features a static minimum and maximum RPM of 2,900, ensuring consistent airflow and cooling performance across a range of operating conditions. This high RPM provides effective heat dissipation, which is particularly beneficial for high-performance CPUs. The noise level remains constant at 25 dB, suggesting that it operates quietly, which is advantageous for users seeking a low-noise environment.",https://m.media-amazon.com/images/I/41eOV22nmDL._SL500_.jpg,"{'Nuevos': {'Cantidad': 1, 'Precio': '132.64 €.'}}"
https://pc-builds.com/es/parts/cooler/JcqPNz/be-quiet-pure-rock-slim-2,be quiet! Pure Rock Slim 2,"{'Ruido máximo': '25.4 dB', 'Altura': '135 mm', 'Refrigerado por agua': 'No', 'Sin ventilador': 'No'}","The be quiet! Pure Rock Slim 2 is designed for efficient cooling, featuring a minimum noise level of 13.1 dB, which allows it to operate quietly during low-load situations. At its maximum noise level of 25.4 dB, it still maintains a relatively low acoustic profile compared to many other coolers, making it suitable for users who prioritize a quiet computing environment.",https://m.media-amazon.com/images/I/31Trry8uZuL._SL500_.jpg,"{'Nuevos': {'Cantidad': 5, 'Precio': '36.85 $.'}, 'Utilizados': {'Cantidad': 2, 'Precio': '24.43 €.'}}"
https://pc-builds.com/es/parts/cooler/tQ3hdT/ek-ek-nucleus-aio-cr360-lux-d-rgb,EK EK-Nucleus AIO CR360 Lux D-RGB,"{'RPM máximas': '2,300', 'Ruido máximo': '36 dB', 'Refrigerado por agua': 'Sí', 'Longitud del radiador': '360 mm', 'Sin ventilador': 'No'}","The EK EK-Nucleus AIO CR360 Lux D-RGB cooler features a minimum RPM of 550 and a maximum RPM of 2,300, providing a wide range of cooling performance based on system demands. It operates at a consistent noise level of 36 dB, indicating it maintains a relatively quiet operation, even at its highest performance settings. The design ensures that noise does not fluctuate, making it suitable for environments where low acoustics are prioritized.",https://m.media-amazon.com/images/I/313nJmWcuPL._SL500_.jpg,"{'Nuevos': {'Cantidad': 1, 'Precio': '203.19 €.'}}"
https://pc-builds.com/es/parts/cooler/vRwyFo/cooler-master-masterliquid-ml240-illusion,Cooler Master MasterLiquid ML240 Illusion,"{'RPM máximas': '1,800', 'Ruido máximo': '30 dB', 'Refrigerado por agua': 'Sí', 'Longitud del radiador': '240 mm', 'Sin ventilador': 'No'}","The Cooler Master MasterLiquid ML240 Illusion features a dual radiator design with a length of 240 mm, providing efficient cooling capabilities for high-performance computing tasks. With a minimum RPM of 650 and a maximum of 1,800, this cooler allows for customizable airflow and thermal management while maintaining noise levels as low as 6 dB at its quietest and peaking at 30 dB under maximum load, making it suitable for various environments.",https://m.media-amazon.com/images/I/4114j0BQ1ES._SL500_.jpg,"{'Nuevos': {'Cantidad': 1, 'Precio': '156.09 $.'}}"
https://pc-builds.com/es/parts/cooler/WTkDkL/zalman-cnps7x-led,Zalman CNPS7X LED,"{'RPM máximas': '1,950', 'Ruido máximo': '25 dB', 'Altura': '135 mm', 'Refrigerado por agua': 'No', 'Sin ventilador': 'No'}","The Zalman CNPS7X LED cooler operates within a RPM range of 1,250 to 1,950, allowing for a balance between efficient cooling and noise levels. At minimum performance, the cooler emits a sound level of 17 dB, which is relatively quiet, while at maximum, it reaches 25 dB, still within an acceptable range for most users concerned about noise. The cooler's height measures 135 mm, making it compatible with various cases without major interference.",https://m.media-amazon.com/images/I/51IptwW+iVL._SL500_.jpg,"{'Nuevos': {'Cantidad': 4, 'Precio': '18.53 €.'}}"
https://pc-builds.com/es/parts/cooler/hctLHP/id-cooling-se-903-xt,ID-COOLING SE-903-XT,"{'RPM máximas': '2,200', 'Ruido máximo': '25.8 dB', 'Altura': '123 mm', 'Refrigerado por agua': 'No', 'Sin ventilador': 'No'}","The ID-COOLING SE-903-XT cooler operates within a minimum RPM of 500 and a maximum of 2,200, providing a flexible cooling range suitable for various CPU demands. It maintains a consistent noise level of 25.8 dB, ensuring quiet operation regardless of fan speed, which is beneficial for users seeking a low-noise environment while gaming or during intensive tasks.",https://m.media-amazon.com/images/I/41zv0d2uZrL._SL500_.jpg,"{'Nuevos': {'Cantidad': 1, 'Precio': '14.99 $.'}}"
https://pc-builds.com/es/parts/cooler/HX3hdT/nzxt-kraken-x73-rgb,NZXT Kraken X73 RGB,"{'RPM máximas': '1,500', 'Ruido máximo': '33 dB', 'Refrigerado por agua': 'Sí', 'Longitud del radiador': '360 mm', 'Sin ventilador': 'No'}","The NZXT Kraken X73 RGB features a fan RPM range from a minimum of 500 to a maximum of 1,500, allowing for dynamic cooling performance depending on the system demands. It operates with a noise level between 22 dB at its lowest speed and 33 dB at maximum, enabling relatively quiet operation which can be beneficial for users sensitive to sound.",https://m.media-amazon.com/images/I/41mTVVTyXXL._SL500_.jpg,"{'Nuevos': {'Cantidad': 1, 'Precio': '399.99 $.'}}"
https://pc-builds.com/es/parts/cooler/8c89a4/noctua-nh-d15-g2,Noctua NH-D15 G2,"{'RPM máximas': '1,500', 'Ruido máximo': '24.8 dB', 'Altura': '168 mm', 'Refrigerado por agua': 'No', 'Sin ventilador': 'No'}","The Noctua NH-D15 G2 cooler operates at a fixed minimum and maximum RPM of 1,500, ensuring consistent airflow throughout its operation. This design enables reliable thermal performance without variance in speed, contributing to stability during prolonged use in demanding applications. The cooler emits a low noise level of 24.8 dB across its operational range, making it suitable for those seeking a quiet computing environment.",https://m.media-amazon.com/images/I/51-eBeqvOrL._SL500_.jpg,"{'Nuevos': {'Cantidad': 1, 'Precio': '149.90 €.'}}"
https://pc-builds.com/es/parts/cooler/CxMMDY/thermalright-frozen-warframe,Thermalright Frozen Warframe,"{'RPM máximas': '2,000', 'Ruido máximo': '22.1 dB', 'Refrigerado por agua': 'Sí', 'Longitud del radiador': '240 mm', 'Sin ventilador': 'No'}","The Thermalright Frozen Warframe features a fixed speed of 2,000 RPM, providing consistency in cooling performance. Its noise level is also consistent, operating at a minimum and maximum of 22.1 dB, which indicates a relatively quiet operation suitable for various environments. The design emphasizes efficient cooling with minimal auditory disturbance.",https://m.media-amazon.com/images/I/41O8XqUlCjL._SL500_.jpg,"{'Nuevos': {'Cantidad': 1, 'Precio': '96.90 $.'}}"
https://pc-builds.com/es/parts/cooler/6VkWX5/be-quiet-pure-loop-2-fx,be quiet! Pure Loop 2 FX,"{'Ruido máximo': '32.3 dB', 'Refrigerado por agua': 'Sí', 'Longitud del radiador': '240 mm', 'Sin ventilador': 'No'}","The be quiet! Pure Loop 2 FX is a liquid cooler designed to offer efficient thermal management for various CPU sockets, including AM4, AM5, and multiple LGA sockets. Its capabilities enable broad compatibility across different systems, enhancing its utility for diverse builds and upgrading needs. The cooler employs a water cooling mechanism which is fundamental for maintaining optimal temperatures, especially during high-performance tasks.",https://m.media-amazon.com/images/I/31hEDPc8S4L._SL500_.jpg,"{'Nuevos': {'Cantidad': 5, 'Precio': '130.01 $.'}, 'Utilizados': {'Cantidad': 2, 'Precio': '115.87 €.'}}"
https://pc-builds.com/es/parts/cooler/6RkqGA/thermalright-core-vision-argb,Thermalright Core Vision ARGB,"{'RPM máximas': '2,000', 'Ruido máximo': '27.7 dB', 'Altura': '66 mm', 'Refrigerado por agua': 'Sí', 'Longitud del radiador': '360 mm', 'Sin ventilador': 'No'}","The Thermalright Core Vision ARGB cooler operates at a fixed minimum and maximum RPM of 2,000, which ensures consistent performance across a range of conditions. It maintains a noise level of 27.7 dB, making it relatively quiet for use in different environments. With a height of 66 mm, it provides a compact form factor suitable for various PC builds without taking up excessive space.",https://m.media-amazon.com/images/I/31gcrtxvdAL._SL500_.jpg,"{'Nuevos': {'Cantidad': 1, 'Precio': '100.90 €.'}}"
https://pc-builds.com/es/parts/cooler/FJxaa4/thermaltake-frio-silent-14,Thermaltake Frio Silent 14,"{'RPM máximas': '1,200', 'Ruido máximo': '19.3 dB', 'Altura': '160 mm', 'Refrigerado por agua': 'No', 'Sin ventilador': 'No'}","The Thermaltake Frio Silent 14 features a minimum RPM of 700 and a maximum RPM of 1,200, providing a balanced performance range that caters to both quiet operation and effective cooling. The noise generated by the cooler ranges from a minimum of 12 dB to a maximum of 19.3 dB, ensuring it remains relatively quiet during operation, which is beneficial for builds prioritizing low noise levels.",https://m.media-amazon.com/images/I/51C2peOEo2L._SL500_.jpg,"{'Nuevos': {'Cantidad': 4, 'Precio': '96.16 $.'}}"
https://pc-builds.com/es/parts/cooler/pYZaa4/asus-rog-strix-lc-ii-argb,Asus ROG STRIX LC II ARGB,"{'RPM máximas': '2,500', 'Ruido máximo': '37.6 dB', 'Refrigerado por agua': 'Sí', 'Longitud del radiador': '120 mm', 'Sin ventilador': 'No'}","The Asus ROG STRIX LC II ARGB cooler features a operational range with a minimum RPM of 800 and a maximum RPM of 2,500, allowing for adaptable cooling performance according to system demand. Noise levels are consistent at 37.6 dB, indicating a relatively quiet operation during use, despite the lack of variable noise levels at different RPMs.",https://m.media-amazon.com/images/I/312Kup3cpPL._SL500_.jpg,"{'Nuevos': {'Cantidad': 1, 'Precio': '129.00 €.'}}"
https://pc-builds.com/es/parts/cooler/MxXJnX/enermax-aquafusion-adv-360,Enermax AQUAFUSION ADV 360,"{'RPM máximas': '2,000', 'Ruido máximo': '32.6 dB', 'Altura': '54 mm', 'Refrigerado por agua': 'Sí', 'Longitud del radiador': '360 mm', 'Sin ventilador': 'No'}","The Enermax AQUAFUSION ADV 360 is designed to deliver efficient cooling for various CPU architectures, supporting an extensive range of sockets including AM2 to AM5 and various LGA models such as LGA1700 and LGA2011-3. This compatibility makes it versatile for different builds, catering to both older and newer systems.",https://m.media-amazon.com/images/I/31JzlU4WYVL._SL500_.jpg,"{'Nuevos': {'Cantidad': 9, 'Precio': '89.90 €.'}, 'Utilizados': {'Cantidad': 2, 'Precio': '67.21 €.'}}"
https://pc-builds.com/es/parts/cooler/Qrm3ib/cooler-master-masterair-ma620p,Cooler Master MasterAir MA620P,"{'RPM máximas': '1,800', 'Ruido máximo': '31 dB', 'Altura': '165 mm', 'Refrigerado por agua': 'No', 'Sin ventilador': 'No'}","The Cooler Master MasterAir MA620P has a minimum RPM of 600 and a maximum RPM of 1,800, allowing for flexible cooling performance based on thermal requirements. This cooling solution operates with a consistent noise level of 31 dB, delivering efficient thermal management without excessive sound output. With a height of 165 mm, it is compact enough to fit in various chassis while still providing adequate airflow.",https://m.media-amazon.com/images/I/51B0sQVFdgL._SL500_.jpg,"{'Nuevos': {'Cantidad': 13, 'Precio': '45.90 €.'}, 'Utilizados': {'Cantidad': 1, 'Precio': '39.99 €.'}}"
https://pc-builds.com/es/parts/cooler/nbwksn/id-cooling-auraflow-x,ID-COOLING AURAFLOW X,"{'RPM máximas': '1,800', 'Ruido máximo': '35.2 dB', 'Refrigerado por agua': 'Sí', 'Longitud del radiador': '240 mm', 'Sin ventilador': 'No'}","The ID-COOLING AURAFLOW X cooler features a wide operational RPM range, with a minimum of 700 RPM and a maximum of 1,800 RPM, offering flexibility for various cooling needs while maintaining efficient performance. It operates relatively quietly, with minimum noise levels at 18 dB, but can reach up to a maximum of 35.2 dB at peak performance, which is suitable for users who value noise control in their systems.",https://m.media-amazon.com/images/I/41GFB8P8f5L._SL500_.jpg,"{'Utilizados': {'Cantidad': 3, 'Precio': '49.99 $.'}}"
https://pc-builds.com/es/parts/cooler/96wn5e/xilence-a404t,Xilence A404T,"{'RPM máximas': '2,200', 'Ruido máximo': '65.4 dB', 'Altura': '55 mm', 'Refrigerado por agua': 'No', 'Sin ventilador': 'No'}","The Xilence A404T cooler operates with minimum and maximum RPM values of 600 and 2,200 respectively, allowing for a significant range of cooling performance depending on the system's thermal demands. Its design achieves a fixed noise level of 65.4 dB, which may be considered on the louder side compared to many contemporary coolers, potentially affecting the overall noise environment of the PC.",https://m.media-amazon.com/images/I/51sMcKpEwfL._SL500_.jpg,"{'Nuevos': {'Cantidad': 1, 'Precio': '77.00 $.'}}"
https://pc-builds.com/es/parts/cooler/Gs4Ysn/thermalright-silver-soul-110,Thermalright Silver Soul 110,"{'RPM máximas': '2,500', 'Ruido máximo': '23 dB', 'Altura': '110 mm', 'Refrigerado por agua': 'No', 'Sin ventilador': 'No'}","The Thermalright Silver Soul 110 features a fixed fan speed with a minimum and maximum RPM of 2,500, ensuring consistent performance under varying thermal loads. Its noise level is notably low at a constant 23 dB, making it suitable for environments where sound sensitivity is a priority.",https://m.media-amazon.com/images/I/41bAbeoiG9L._SL500_.jpg,"{'Nuevos': {'Cantidad': 1, 'Precio': '81.14 $.'}}"
https://pc-builds.com/es/parts/cooler/z9XVjK/id-cooling-sl360,ID-COOLING SL360,"{'RPM máximas': '2,000', 'Ruido máximo': '29.9 dB', 'Altura': '58 mm', 'Refrigerado por agua': 'Sí', 'Longitud del radiador': '360 mm', 'Sin ventilador': 'No'}","The ID-COOLING SL360 cooler features a radiator length of 360 mm, allowing for efficient heat dissipation. Its design supports various sockets, including AM4, AM5, and multiple LGA options, making it versatile for different builds. With a minimum RPM of 500 and a maximum of 2,000, the cooler can adjust its performance according to the cooling demand.",https://m.media-amazon.com/images/I/41-RWX90VIL._SL500_.jpg,"{'Nuevos': {'Cantidad': 1, 'Precio': '259.99 $.'}, 'Utilizados': {'Cantidad': 3, 'Precio': '134.99 $.'}}"
https://pc-builds.com/es/parts/cooler/K4Jpph/thermaltake-th420-v2-ultra-argb-sync,Thermaltake TH420 V2 Ultra ARGB Sync,"{'RPM máximas': '2,000', 'Ruido máximo': '34.7 dB', 'Refrigerado por agua': 'Sí', 'Longitud del radiador': '420 mm', 'Sin ventilador': 'No'}","The Thermaltake TH420 V2 Ultra ARGB Sync cooler offers a dynamic cooling solution with a minimum fan speed of 500 RPM and a maximum of 2,000 RPM, allowing for effective thermal management across a range of workloads. It operates at a consistent noise level of 34.7 dB, which is moderate, ensuring that it provides a balance between performance and operational silence.",https://m.media-amazon.com/images/I/318X-FAjnEL._SL500_.jpg,"{'Nuevos': {'Cantidad': 1, 'Precio': '272.32 $.'}}"
https://pc-builds.com/es/parts/cooler/CK9KXF/rosewill-rcx-z1,Rosewill RCX-Z1,"{'RPM máximas': '3,100', 'Ruido máximo': '33.4 dB', 'Altura': '70 mm', 'Refrigerado por agua': 'No', 'Sin ventilador': 'No'}","The Rosewill RCX-Z1 cooler operates within a minimum RPM of 1,700 and a maximum of 3,100, offering a balance of cooling performance and noise management. Noise levels range from a low 18 dB at minimum RPM, increasing to 33.4 dB at maximum RPM, making it suitable for users looking for moderate acoustics while maintaining adequate cooling capacity.",https://images.pc-builds.com/images/components/af4f8870036611f708b98060d3541174/98168773f916c934ac20bebba5bddafb/db4a3516a670071f2fa6fcab81c01996.png,N/A
https://pc-builds.com/es/parts/cooler/2L3hdT/be-quiet-pure-rock-2-fx,be quiet! Pure Rock 2 FX,"{'Ruido máximo': '24.4 dB', 'Altura': '155 mm', 'Refrigerado por agua': 'No', 'Sin ventilador': 'No'}","The be quiet! Pure Rock 2 FX cooler operates with a minimum noise level of 7.9 dB, smoothing the auditory experience during operation. At its maximum, noise levels can reach 24.4 dB, which is relatively average for air coolers, providing adequate cooling while remaining unobtrusive for most users.",https://m.media-amazon.com/images/I/31c9GwBMERL._SL500_.jpg,"{'Nuevos': {'Cantidad': 18, 'Precio': '61.56 €.'}}"
