URL,Nombre,Características,Descripción,Imagen,Precios
https://pc-builds.com/es/parts/cooler/VkGi5e/id-cooling-fx360-pro,ID-COOLING FX360 PRO,"{'RPM máximas': '1,800', 'Ruido máximo': '35.2 dB', 'Altura': '50 mm', 'Refrigerado por agua': 'Sí', 'Longitud del radiador': '360 mm', 'Sin ventilador': 'No'}","The ID-COOLING FX360 PRO features a minimum RPM of 500 and a maximum of 1,800, providing a flexible range for cooling efficiency based on user needs. With a constant noise level of 35.2 dB, it ensures a quiet operation, maintaining a balance between performance and sound. The cooler has a height of 50 mm, making it compact enough to fit various setups without overcrowding other components.",https://m.media-amazon.com/images/I/41Ocrx8XtpL._SL500_.jpg,"{'Nuevos': {'Cantidad': 1, 'Precio': '97.34 $.'}}"
https://pc-builds.com/es/parts/cooler/yDBA0g/be-quiet-light-loop,be quiet! Light Loop,"{'RPM máximas': '2,900', 'Ruido máximo': '36.8 dB', 'Refrigerado por agua': 'Sí', 'Longitud del radiador': '360 mm', 'Sin ventilador': 'No'}","The be quiet! Light Loop cooler operates within a RPM range of 1,500 to 2,900, providing flexibility in cooling efficiency and noise management. At minimum, the noise level is recorded at 17.2 dB, which is relatively quiet, making it ideal for users looking for a subdued operation. However, under full load, the noise can rise to 36.8 dB, indicating a more noticeable sound during intense usage.",https://m.media-amazon.com/images/I/31e6hOx400L._SL500_.jpg,"{'Nuevos': {'Cantidad': 5, 'Precio': '146.95 $.'}}"
https://pc-builds.com/es/parts/cooler/RqXVjK/gigabyte-aorus-waterforce-x-ii-360,Gigabyte AORUS WATERFORCE X II 360,"{'RPM máximas': '2,400', 'Ruido máximo': '37.5 dB', 'Altura': '78 mm', 'Refrigerado por agua': 'Sí', 'Longitud del radiador': '360 mm', 'Sin ventilador': 'No'}","The Gigabyte AORUS WATERFORCE X II 360 is a water-cooled CPU cooler designed to effectively dissipate heat from high-performance processors. It operates with a broad range of RPMs, starting from a minimum of 800 and ramping up to a maximum of 2,400 RPM. This flexibility allows the cooler to balance between performance and acoustic noise, which is notable given its minimum noise level of 12 dB and a maximum of 37.5 dB during full operation.",https://m.media-amazon.com/images/I/41+fg-y9uFL._SL500_.jpg,"{'Nuevos': {'Cantidad': 14, 'Precio': '239.96 €.'}, 'Utilizados': {'Cantidad': 2, 'Precio': '173.67 €.'}}"
https://pc-builds.com/es/parts/cooler/fQqPNz/be-quiet-silent-loop-2-280,be quiet! Silent Loop 2 280,"{'RPM máximas': '1,600', 'Ruido máximo': '36.1 dB', 'Refrigerado por agua': 'Sí', 'Longitud del radiador': '280 mm', 'Sin ventilador': 'No'}","The be quiet! Silent Loop 2 280 is a liquid cooling system designed for a range of socket types, making it versatile for various CPU models, including AM4 and LGA1700. It features a maximum rotation speed of 1,600 RPM, allowing for steady airflow while maintaining efficiency in cooling performance. The specified radiator length of 280 mm enhances its cooling capabilities, facilitating optimal heat dissipation through its larger surface area.",https://m.media-amazon.com/images/I/31yATEXGmGL._SL500_.jpg,"{'Nuevos': {'Cantidad': 2, 'Precio': '280.79 $.'}, 'Utilizados': {'Cantidad': 2, 'Precio': '109.65 €.'}}"
https://pc-builds.com/es/parts/cooler/MkDQPG/cooler-master-hyper-622-halo,Cooler Master Hyper 622 Halo,"{'RPM máximas': '2,050', 'Ruido máximo': '27 dB', 'Altura': '157 mm', 'Refrigerado por agua': 'No', 'Sin ventilador': 'No'}","The Cooler Master Hyper 622 Halo features a minimum fan speed of 650 RPM, which allows for efficient operation under low thermal demands. It can reach a maximum RPM of 2,050, providing robust airflow for cooling even during demanding tasks. The noise level remains consistent at 27 dB, ensuring a quiet environment, making it suitable for users who prioritize low acoustics while still needing effective cooling performance.",https://m.media-amazon.com/images/I/41fNXfOMnAL._SL500_.jpg,"{'Nuevos': {'Cantidad': 1, 'Precio': '131.39 $.'}}"
https://pc-builds.com/es/parts/cooler/CYhFvf/nzxt-kraken-x53-rgb,NZXT Kraken X53 RGB,"{'RPM máximas': '1,500', 'Ruido máximo': '33 dB', 'Refrigerado por agua': 'Sí', 'Longitud del radiador': '240 mm', 'Sin ventilador': 'No'}","The NZXT Kraken X53 RGB is a liquid CPU cooler designed to provide efficient cooling for various socket types, including AM4, AM5, and multiple LGA configurations up to LGA 2066. Its integration of RGB lighting enhances aesthetic appeal while ensuring functionality, making it a dual-purpose component for gamers and PC enthusiasts alike.",https://m.media-amazon.com/images/I/41Ltrw5LQwL._SL500_.jpg,"{'Nuevos': {'Cantidad': 4, 'Precio': '204.91 €.'}}"
https://pc-builds.com/es/parts/cooler/R6P9a4/id-cooling-frozn-a410-black,ID-COOLING FROZN A410 BLACK,"{'RPM máximas': '2,000', 'Ruido máximo': '29.85 dB', 'Altura': '152 mm', 'Refrigerado por agua': 'No', 'Sin ventilador': 'No'}","The ID-COOLING FROZN A410 BLACK is a CPU cooler that operates within a minimum RPM of 500 and can ramp up to a maximum of 2,000 RPM. This range allows for flexible cooling performance, suitable for various workloads. The noise level remains consistent at 29.85 dB, which is relatively quiet and ensures a more pleasant computing environment.",https://m.media-amazon.com/images/I/41U7+6OZpVL._SL500_.jpg,"{'Nuevos': {'Cantidad': 1, 'Precio': '44.99 $.'}, 'Utilizados': {'Cantidad': 5, 'Precio': '22.62 $.'}}"
https://pc-builds.com/es/parts/cooler/pYZA0g/lian-li-galahad-aio-240-rgb,Lian Li GALAHAD AIO 240 RGB,"{'RPM máximas': '1,900', 'Refrigerado por agua': 'Sí', 'Longitud del radiador': '240 mm', 'Sin ventilador': 'No'}","The Lian Li GALAHAD AIO 240 RGB is a liquid cooling solution designed to handle a range of high-performance processors. It operates within a minimum RPM of 800 and can ramp up to a maximum of 1,900 RPM, allowing for flexible cooling capabilities depending on system demands. The cooler supports a variety of socket types, including AM4, AM5, and various LGA sockets, making it a versatile choice for many CPUs.",https://m.media-amazon.com/images/I/41pO4LT0ygL._SL500_.jpg,"{'Nuevos': {'Cantidad': 1, 'Precio': '235.59 $.'}, 'Utilizados': {'Cantidad': 1, 'Precio': '180.22 $.'}}"
https://pc-builds.com/es/parts/cooler/ZDM4ol/gamdias-boreas-e1,GAMDIAS BOREAS E1,"{'RPM máximas': '2,000', 'Ruido máximo': '31 dB', 'Altura': '154 mm', 'Refrigerado por agua': 'No', 'Sin ventilador': 'No'}","The GAMDIAS BOREAS E1 cooler operates within a fan speed range of 800 to 2,000 RPM, providing flexibility for varying cooling demands. It produces a minimum noise level of 10 dB, ensuring quiet operation during low-load scenarios, while peaking at a maximum of 31 dB under high load, which is reasonable for air cooling solutions.",https://m.media-amazon.com/images/I/51dGsQQT30L._SL500_.jpg,"{'Nuevos': {'Cantidad': 1, 'Precio': '65.01 $.'}}"
https://pc-builds.com/es/parts/cooler/7LZXJ6/xilence-i404t,Xilence I404T,"{'RPM máximas': '2,200', 'Ruido máximo': '21.8 dB', 'Altura': '55 mm', 'Refrigerado por agua': 'No', 'Sin ventilador': 'No'}","The Xilence I404T cooler operates within a minimum RPM range of 600 and can reach a maximum of 2,200 RPM, allowing for flexibility in cooling performance depending on the thermal demands of the system. This range ensures that it can handle varying workloads while maintaining efficiency. Noise levels are relatively low, ranging from a minimum of 14 dB to a maximum of 21.8 dB, making it suitable for builds where quiet operation is a priority.",https://m.media-amazon.com/images/I/51g9ZRL3hGL._SL500_.jpg,"{'Nuevos': {'Cantidad': 1, 'Precio': '66.00 $.'}}"
https://pc-builds.com/es/parts/cooler/q32bJe/deepcool-castle-240ex,Deepcool CASTLE 240EX,"{'RPM máximas': '1,800', 'Ruido máximo': '32.1 dB', 'Refrigerado por agua': 'Sí', 'Longitud del radiador': '240 mm', 'Sin ventilador': 'No'}","The Deepcool CASTLE 240EX operates with a minimum RPM of 500 and a maximum RPM of 1,800, making it versatile for various cooling demands. Its noise level is consistent at 32.1 dB, which indicates relatively quiet operation, suitable for environments where noise is a concern. The design is optimized for performance while maintaining a balanced sound profile.",https://m.media-amazon.com/images/I/31m6m7hYeML._SL500_.jpg,"{'Nuevos': {'Cantidad': 2, 'Precio': '10.99 $.'}}"
https://pc-builds.com/es/parts/cooler/fLJBTb/thermalright-hyper-vision-argb,Thermalright Hyper Vision ARGB,"{'RPM máximas': '2,150', 'Ruido máximo': '27 dB', 'Altura': '68 mm', 'Refrigerado por agua': 'Sí', 'Sin ventilador': 'No'}","The Thermalright Hyper Vision ARGB cooler operates at a fixed speed of 2,150 RPM, which contributes to consistent cooling performance. It maintains a noise level of 27 dB under all operating conditions, making it a relatively quiet option for users who prefer minimal acoustic disturbance while gaming or working.",https://m.media-amazon.com/images/I/41W7BS8mTHL._SL500_.jpg,"{'Nuevos': {'Cantidad': 1, 'Precio': '160.90 €.'}}"
https://pc-builds.com/es/parts/cooler/HG7GjK/silverstone-ar12-tuf,Silverstone AR12-TUF,"{'RPM máximas': '2,200', 'Ruido máximo': '34.4 dB', 'Altura': '154 mm', 'Refrigerado por agua': 'No', 'Sin ventilador': 'No'}","The Silverstone AR12-TUF features a minimum RPM of 300 and a maximum of 2,200, providing a versatile cooling option for various system demands. With a noise range from a minimum of 6.2 dB to a maximum of 34.4 dB, it allows users to choose between quieter operations or heightened airflow as required. Its height of 154 mm makes it a compact choice for many setups, while ensuring adequate cooling efficiency.",https://m.media-amazon.com/images/I/413O4RZhq8L._SL500_.jpg,"{'Nuevos': {'Cantidad': 3, 'Precio': '85.21 $.'}}"
https://pc-builds.com/es/parts/cooler/ZTF4ol/silverstone-ar08,Silverstone AR08,"{'RPM máximas': '2,800', 'Ruido máximo': '27.7 dB', 'Altura': '134 mm', 'Refrigerado por agua': 'No', 'Sin ventilador': 'No'}","The Silverstone AR08 cooler offers a minimum RPM of 1,500 and a maximum RPM of 2,800, allowing users to adjust for optimal cooling performance or quieter operation depending on their needs. Noise levels range from 14.1 dB at minimum to a maximum of 27.7 dB when running at full speed, indicating it maintains a relatively quiet profile suitable for various environments.",https://m.media-amazon.com/images/I/314mCZPrqGL._SL500_.jpg,"{'Nuevos': {'Cantidad': 2, 'Precio': '32.13 €.'}}"
https://pc-builds.com/es/parts/cooler/mFYRJ6/msi-mag-coreliquid-e240,MSI MAG CORELIQUID E240,"{'Refrigerado por agua': 'Sí', 'Longitud del radiador': '240 mm', 'Sin ventilador': 'No'}","The MSI MAG CORELIQUID E240 is a water cooling solution that supports a variety of socket types including AM4, AM5, and multiple LGA configurations from LGA1150 to LGA1700. This broad compatibility makes it suitable for a range of modern CPU architectures, enhancing its appeal for users looking to maintain performance across different systems.",https://m.media-amazon.com/images/I/413eSvK4Y1L._SL500_.jpg,"{'Nuevos': {'Cantidad': 39, 'Precio': '109.54 €.'}, 'Utilizados': {'Cantidad': 4, 'Precio': '61.47 €.'}}"
https://pc-builds.com/es/parts/cooler/8NMMDY/xilence-m704pro-argb,Xilence M704PRO.ARGB,"{'RPM máximas': '1,800', 'Ruido máximo': '32.2 dB', 'Altura': '159 mm', 'Refrigerado por agua': 'No', 'Sin ventilador': 'No'}","The Xilence M704PRO.ARGB features a minimum RPM of 800 and a maximum RPM of 1,800, allowing for customizable cooling performance depending on the demands placed on the processor. The cooler operates within a noise range of 18 dB at minimum RPM to a maximum of 32.2 dB, striking a balance between performance and acoustic management for various user preferences.",https://m.media-amazon.com/images/I/41pJipH8BPL._SL500_.jpg,"{'Nuevos': {'Cantidad': 6, 'Precio': '34.34 €.'}}"
https://pc-builds.com/es/parts/cooler/gJTZNz/thermaltake-th280-v2-ultra-argb-sync,Thermaltake TH280 V2 Ultra ARGB Sync,"{'RPM máximas': '2,000', 'Ruido máximo': '34.7 dB', 'Refrigerado por agua': 'Sí', 'Longitud del radiador': '280 mm', 'Sin ventilador': 'No'}","The Thermaltake TH280 V2 Ultra ARGB Sync cooler offers extensive compatibility with various socket types, including AM and LGA series, ensuring it can fit a wide range of CPU models. With a radiator length of 280 mm, it is designed to provide significant cooling performance, making it suitable for systems requiring efficient heat dissipation. The unit supports water cooling, which enhances thermal management for high-performance builds.",https://m.media-amazon.com/images/I/31NfwERyQUL._SL500_.jpg,"{'Nuevos': {'Cantidad': 4, 'Precio': '218.16 $.'}}"
https://pc-builds.com/es/parts/cooler/htkhdT/nzxt-kraken-z73,NZXT Kraken Z73,"{'RPM máximas': '1,800', 'Ruido máximo': '36 dB', 'Refrigerado por agua': 'Sí', 'Longitud del radiador': '360 mm', 'Sin ventilador': 'No'}","The NZXT Kraken Z73 cooler features a minimum RPM of 500 and a maximum of 1,800, allowing for customizable cooling performance based on the needs of the system. This range provides an effective balance between cooling power and noise levels, which are specified to be as low as 21 dB at minimum and reaching up to 36 dB at maximum RPM.",https://images.pc-builds.com/images/components/af4f8870036611f708b98060d3541174/b5ce790d30347e16d55da2d33726d064/db4a3516a670071f2fa6fcab81c01996.png,N/A
https://pc-builds.com/es/parts/cooler/FTDJnX/evga-clc-120-cl11,EVGA CLC 120 CL11,"{'RPM máximas': '1,800', 'Ruido máximo': '32.1 dB', 'Refrigerado por agua': 'Sí', 'Longitud del radiador': '120 mm', 'Sin ventilador': 'No'}","The EVGA CLC 120 CL11 is a closed-loop liquid cooler featuring a fixed fan speed of 1,800 RPM, ensuring consistent cooling performance across various operations. It produces a noise level of 32.1 dB, which could be considered moderately loud for a cooling solution but may still be acceptable for most gaming setups.",https://m.media-amazon.com/images/I/31SNV5nnOpL._SL500_.jpg,"{'Nuevos': {'Cantidad': 1, 'Precio': '65.38 €.'}}"
https://pc-builds.com/es/parts/cooler/47Zaa4/msi-meg-coreliquid-s280,MSI MEG CORELIQUID S280,"{'Ruido máximo': '24.9 dB', 'Refrigerado por agua': 'Sí', 'Longitud del radiador': '280 mm', 'Sin ventilador': 'No'}","The MSI MEG CORELIQUID S280 operates at a consistent noise level of 24.9 dB, making it relatively quiet for a cooling solution, which is beneficial for users who prioritize low acoustic performance in their builds. Despite the minimum and maximum noise specifications being the same, indicating stable operation under different conditions, it does not support complete fanless functionality.",https://m.media-amazon.com/images/I/31cdvYuRHaL._SL500_.jpg,"{'Nuevos': {'Cantidad': 8, 'Precio': '245.99 €.'}}"
https://pc-builds.com/es/parts/cooler/jRmLHP/evercool-ec-nk804a-925ep,Evercool EC-NK804A-925EP,"{'RPM máximas': '2,750', 'Ruido máximo': '28.2 dB', 'Altura': '56 mm', 'Refrigerado por agua': 'No', 'Sin ventilador': 'No'}","The Evercool EC-NK804A-925EP operates at a fixed speed of 2,750 RPM, ensuring consistent performance without fluctuation. This designated RPM contributes to a minimal noise level of 28.2 dB, indicating that the cooler maintains a relatively quiet operation during use, making it suitable for users who prioritize silence in their setups.",https://m.media-amazon.com/images/I/51k5y+obZ1L._SL500_.jpg,"{'Nuevos': {'Cantidad': 1, 'Precio': '19.49 $.'}}"
https://pc-builds.com/es/parts/cooler/d3xRJ6/thermalright-assassin-x,Thermalright Assassin X,"{'RPM máximas': '1,500', 'Ruido máximo': '25.6 dB', 'Altura': '154 mm', 'Refrigerado por agua': 'No', 'Sin ventilador': 'No'}","The Thermalright Assassin X cooler operates at a constant speed, with both its minimum and maximum RPM set at 1,500. This fixed RPM contributes to a consistent cooling performance, although it does limit customization in terms of fan speed control. The cooler generates a constant noise level of 25.6 dB, which is relatively quiet, making it suitable for environments where noise reduction is a priority.",https://m.media-amazon.com/images/I/41aJwdGRuAL._SL500_.jpg,"{'Nuevos': {'Cantidad': 1, 'Precio': '21.90 €.'}, 'Utilizados': {'Cantidad': 2, 'Precio': '20.59 €.'}}"
https://pc-builds.com/es/parts/cooler/D2RwHP/thermaltake-th420-argb-sync,Thermaltake TH420 ARGB Sync,"{'RPM máximas': '1,800', 'Ruido máximo': '34.7 dB', 'Refrigerado por agua': 'Sí', 'Longitud del radiador': '420 mm', 'Sin ventilador': 'No'}","The Thermaltake TH420 ARGB Sync cooler features a minimum RPM of 500 and a maximum RPM of 1,800, which allows for flexible cooling performance based on the system's requirements. The noise levels are consistent at 34.7 dB, ensuring that it operates quietly while maintaining effective thermal management, suitable for a variety of gaming and workstation environments.",https://m.media-amazon.com/images/I/41V+QuUU3hL._SL500_.jpg,"{'Nuevos': {'Cantidad': 2, 'Precio': '200.94 $.'}}"
https://pc-builds.com/es/parts/cooler/qVFKXF/silverstone-pf120-argb,Silverstone PF120-ARGB,"{'RPM máximas': '2,200', 'Ruido máximo': '35.6 dB', 'Refrigerado por agua': 'Sí', 'Longitud del radiador': '120 mm', 'Sin ventilador': 'No'}","The Silverstone PF120-ARGB cooler features a broad operational range, with a minimum RPM of 600 and a maximum RPM of 2,200, allowing for customizable cooling performance. Its noise levels range from a minimum of 7.4 dB to a maximum of 35.6 dB, making it suitable for both quiet and high-performance environments, though users should note the potential for increased noise under heavy load.",https://m.media-amazon.com/images/I/41HFEnEuCyL._SL500_.jpg,"{'Nuevos': {'Cantidad': 1, 'Precio': '78.21 €.'}}"
https://pc-builds.com/es/parts/cooler/QMCFvf/silverstone-pf360-argb,Silverstone PF360-ARGB,"{'RPM máximas': '2,200', 'Ruido máximo': '35.6 dB', 'Refrigerado por agua': 'Sí', 'Longitud del radiador': '360 mm', 'Sin ventilador': 'No'}","The Silverstone PF360-ARGB cooler features a broad RPM range from a minimum of 600 to a maximum of 2,200, allowing for responsive cooling performance under various thermal loads. Its noise levels are relatively low, starting at 7.4 dB and reaching a maximum of 35.6 dB, making it suitable for users seeking a balance between performance and quiet operation. The cooler's design accommodates a range of modern CPU sockets, including AM2 to AM5 and various LGA sockets, providing versatility for different builds.",https://m.media-amazon.com/images/I/41+WoyWuP5L._SL500_.jpg,"{'Nuevos': {'Cantidad': 4, 'Precio': '130.90 €.'}}"
https://pc-builds.com/es/parts/cooler/FTRFvf/cooler-master-masterair-pro-3,Cooler Master MasterAir Pro 3,"{'RPM máximas': '3,000', 'Ruido máximo': '30 dB', 'Altura': '140 mm', 'Refrigerado por agua': 'No', 'Sin ventilador': 'No'}","The Cooler Master MasterAir Pro 3 features a minimum RPM of 650, allowing for quiet operation at low workloads, while its maximum RPM reaches up to 3,000, providing efficient cooling during intensive tasks. This range supports a noise level starting at 6 dB under minimal load and peaking at 30 dB, making it relatively quiet compared to other cooling solutions, but capable of ramping up to handle higher thermal demands.",https://m.media-amazon.com/images/I/51DLxf+GQLL._SL500_.jpg,"{'Nuevos': {'Cantidad': 1, 'Precio': '45.16 €.'}, 'Utilizados': {'Cantidad': 1, 'Precio': '29.00 €.'}}"
https://pc-builds.com/es/parts/cooler/g7Jpph/id-cooling-frozn-a410-dk,ID-COOLING FROZN A410 DK,"{'RPM máximas': '2,000', 'Ruido máximo': '29.85 dB', 'Altura': '152 mm', 'Refrigerado por agua': 'No', 'Sin ventilador': 'No'}","The ID-COOLING FROZN A410 DK cooler operates within a minimum RPM of 500 and can reach up to 2,000 RPM, providing adequate airflow for effective cooling. It maintains a consistent noise level of 29.85 dB, which is relatively quiet, making it suitable for users who prefer low-noise cooling solutions.",https://m.media-amazon.com/images/I/41rp6vGxVuL._SL500_.jpg,"{'Nuevos': {'Cantidad': 1, 'Precio': '44.99 $.'}, 'Utilizados': {'Cantidad': 1, 'Precio': '29.69 $.'}}"
https://pc-builds.com/es/parts/cooler/DYzksn/asus-rog-ryuo-120-rgb,Asus ROG RYUO 120 RGB,"{'RPM máximas': '2,500', 'Ruido máximo': '37 dB', 'Refrigerado por agua': 'Sí', 'Longitud del radiador': '120 mm', 'Sin ventilador': 'No'}","The Asus ROG RYUO 120 RGB cooler features a minimum RPM of 800 and can ramp up to a maximum of 2,500 RPM. This range allows it to adapt to various cooling requirements based on the system's thermal conditions. Noise levels are constant at a minimum and maximum of 37 dB, indicating that the cooler operates relatively quietly during use, making it suitable for environments where noise is a concern.",https://m.media-amazon.com/images/I/41xbfD9VrOL._SL500_.jpg,"{'Nuevos': {'Cantidad': 35, 'Precio': '99.09 €.'}}"
https://pc-builds.com/es/parts/cooler/Z6zksn/be-quiet-dark-rock-pro-tr4,be quiet! Dark Rock Pro TR4,"{'RPM máximas': '1,500', 'Ruido máximo': '24.3 dB', 'Altura': '163 mm', 'Refrigerado por agua': 'No', 'Sin ventilador': 'No'}","The be quiet! Dark Rock Pro TR4 cooler features a minimum RPM of 1,200 and a maximum RPM of 1,500, allowing for adjustable airflow and cooling performance. It operates at a minimum noise level of 12.8 dB, which is relatively quiet, making it suitable for users who prioritize low noise levels in their systems. At maximum RPM, it produces a noise level of 24.3 dB, still within an acceptable range for a high-performance air cooler.",https://m.media-amazon.com/images/I/512N43tYX7L._SL500_.jpg,"{'Nuevos': {'Cantidad': 1, 'Precio': '145.86 $.'}, 'Utilizados': {'Cantidad': 14, 'Precio': '49.00 €.'}}"
https://pc-builds.com/es/parts/cooler/bHCwHP/dynatron-t318,Dynatron T318,"{'Ruido máximo': '0 dB', 'Altura': '27 mm', 'Refrigerado por agua': 'No', 'Sin ventilador': 'Sí'}","The Dynatron T318 cooler is characterized by its unique operation, generating minimum and maximum noise levels of 0 dB, making it completely silent during operation. This feature is particularly beneficial for users seeking a quiet computing environment, such as in home theater PCs or noise-sensitive applications.",https://m.media-amazon.com/images/I/41cnQB6SY7L._SL500_.jpg,"{'Nuevos': {'Cantidad': 1, 'Precio': '79.95 $.'}}"
https://pc-builds.com/es/parts/cooler/Tv2WX5/cooler-master-masterair-ma612-stealth-argb,Cooler Master MasterAir MA612 Stealth ARGB,"{'RPM máximas': '1,800', 'Ruido máximo': '27 dB', 'Altura': '158 mm', 'Refrigerado por agua': 'No', 'Sin ventilador': 'No'}","The Cooler Master MasterAir MA612 Stealth ARGB features a minimum RPM of 650 and a maximum RPM of 1,800, providing flexibility in performance based on thermal demands. Its noise levels range from a minimum of 8 dB to a maximum of 27 dB, indicating that it operates quietly under low loads and moderately during peak performance. With a height of 158 mm, it fits well in various cases, allowing for effective heat dissipation without significantly impacting space.",https://m.media-amazon.com/images/I/31U6akoeEOL._SL500_.jpg,"{'Nuevos': {'Cantidad': 2, 'Precio': '87.81 $.'}, 'Utilizados': {'Cantidad': 1, 'Precio': '45.62 $.'}}"
https://pc-builds.com/es/parts/cooler/nHBGjK/cooler-master-masterliquid-ml240l-v2-rgb,Cooler Master MasterLiquid ML240L V2 RGB,"{'RPM máximas': '1,800', 'Ruido máximo': '27 dB', 'Refrigerado por agua': 'Sí', 'Longitud del radiador': '240 mm', 'Sin ventilador': 'No'}","The Cooler Master MasterLiquid ML240L V2 RGB features a minimum RPM of 650 and a maximum of 1,800, allowing for effective cooling across a range of performance levels. Its noise output ranges from a minimal 8 dB to a maximum of 27 dB, making it suitable for users seeking a balance between performance and quiet operation. Compatibility with a variety of sockets, including AM4, AM5, LGA1150, and LGA1700 among others, ensures broad support for multiple CPU architectures.",https://m.media-amazon.com/images/I/41ZMI5QK7rL._SL500_.jpg,"{'Nuevos': {'Cantidad': 2, 'Precio': '129.99 $.'}}"
https://pc-builds.com/es/parts/cooler/WyTPNz/silverstone-ar08-v2,Silverstone AR08-V2,"{'RPM máximas': '2,800', 'Ruido máximo': '27.7 dB', 'Altura': '134 mm', 'Refrigerado por agua': 'No', 'Sin ventilador': 'No'}","The Silverstone AR08-V2 cooler operates within a range of rotational speeds, from a minimum of 1,500 RPM to a maximum of 2,800 RPM, providing flexibility in cooling performance based on user requirements. Noise levels vary accordingly, starting from a minimum of 14.1 dB, which signifies a quiet operation, and reaching up to 27.7 dB at maximum RPM, which can be considered moderate.",https://m.media-amazon.com/images/I/51mLp6yCWzS._SL500_.jpg,"{'Nuevos': {'Cantidad': 2, 'Precio': '30.60 €.'}}"
https://pc-builds.com/es/parts/cooler/4mWJnX/lian-li-galahad-ii-lcd,Lian Li Galahad II LCD,"{'RPM máximas': '1,550', 'Ruido máximo': '26.7 dB', 'Refrigerado por agua': 'Sí', 'Longitud del radiador': '280 mm', 'Sin ventilador': 'No'}","The Lian Li Galahad II LCD cooler features a minimum RPM of 300 and a maximum RPM of 1,550. This range provides flexibility in performance, allowing for quiet operation at lower speeds while ramping up for optimal cooling when needed. The noise level remains consistent at a minimum and maximum of 26.7 dB, making it a relatively quiet option for users looking for effective cooling without excessive noise.",https://m.media-amazon.com/images/I/31w8wOnrumL._SL500_.jpg,"{'Nuevos': {'Cantidad': 1, 'Precio': '229.99 $.'}}"
